{
  "schema_version": "1.0.0",
  "record_kind": "math-research-os-working-set",
  "record_id": "research-os:template-working-set-v1",
  "record_version": 1,
  "problem_contract": {
    "problem_id": "problem:template-placeholder",
    "problem_contract_sha256": "0000000000000000000000000000000000000000000000000000000000000000",
    "statement_sha256": "0000000000000000000000000000000000000000000000000000000000000000",
    "scope_sha256": "0000000000000000000000000000000000000000000000000000000000000000",
    "owner_locator": "problem-library/records/canonical-problems.jsonl"
  },
  "claims_ceiling": "candidate_only",
  "frame": {
    "status": "incomplete",
    "question_summary": "Template-only working set fixture; replace with a real ProblemContract before research use.",
    "domain_note": "The public template does not define a mathematical domain.",
    "quantifier_note": "The public template does not define mathematical quantifiers.",
    "definition_refs": [],
    "assumption_notes": ["This fixture is synthetic and is not a research result."],
    "open_boundary_notes": ["A concrete problem repository must bind all hashes to its own ProblemContract."],
    "obligation_refs": []
  },
  "examples": [],
  "conjectures": [
    {
      "conjecture_id": "conjecture:template-one",
      "outcome_ref": "outcome:template-one",
      "statement_sha256": "0000000000000000000000000000000000000000000000000000000000000000",
      "scope_sha256": "0000000000000000000000000000000000000000000000000000000000000000",
      "relation_role": "other",
      "status": "candidate_only",
      "falsifier_notes": "Synthetic fixture only; no mathematical claim is made."
    }
  ],
  "proof_dependencies": [],
  "refutations": [],
  "connections": [],
  "verification": [],
  "supersedes": null,
  "created_at": "2026-01-01T00:00:00Z"
}
